{
  "connection": "connected",
  "errorMessage": null,
  "batteryPercent": 92,
  "isSessionActive": false,
  "isCupOnScale": true,
  "startWeightGrams": 0,
  "lastStableWeightGrams": 0,
  "currentWeightGrams": 320,
  "flowRateGramsPerSec": 0,
  "sessionElapsedSeconds": 0,
  "dailyCaffeineMg": 95,
  "dailyTargetMg": 400,
  "cupsToday": 1,
  "beverage": "drip"
}
