{
  "connection": "connected",
  "errorMessage": null,
  "batteryPercent": 15,
  "isSessionActive": true,
  "isCupOnScale": true,
  "startWeightGrams": 300,
  "lastStableWeightGrams": 150,
  "currentWeightGrams": 150,
  "flowRateGramsPerSec": 0,
  "sessionElapsedSeconds": 3725,
  "dailyCaffeineMg": 1180,
  "dailyTargetMg": 400,
  "cupsToday": 11,
  "beverage": "espresso"
}
